Handle,Title,Vendor,Type,Tags,Published,Variant SKU,Variant Price,SEO Title,SEO Description,Image Src,Product URL
herbal-eye-gel-cucumber,Herbal Eye Gel - Cucumber,HIketron,Skin Care,"Herbal Eye Gel - Cucumber, Herbal Eye Gel - Cucumber - (2 fl oz / 60 ml), Hiketron Skin Care, Skin Care",True,SC-1002,89.99,,"A cooling gel for fresh, youthful eyes. Decrease the appearance of eye fatigue, puffiness and dark circles. ",https://cdn.shopify.com/s/files/1/2672/1228/products/CUCUMBER_HERBAL_EYE_GEL.jpg?v=1581201632,https://www.hiketron.com/products/herbal-eye-gel-cucumber
rejuvenating-beard-oil,Rejuvenating Beard Oil - Coffee Infused,HIketron,Skin Care,"Cold Brew Beard Oil - (1 fl oz / 30 ml), Hiketron Skin Care, Rejuvenating Beard Oil - (1 fl oz / 30 ml), Rejuvenating Beard Oil - Coffee Infused, Rejuvenating Beard Oil - Coffee Infused (1 fl oz / 30 ml), Skin Care",True,SC-1001,79.99,,A coffee-scented facial hair oil for men's groomingPerk-up facial hair with the scent of an Arabian Brew. ,https://cdn.shopify.com/s/files/1/2672/1228/products/REJUVINATING_BEARD_OIL.jpg?v=1581131119,https://www.hiketron.com/products/rejuvenating-beard-oil
fresh-tea-face-mist,Face Mist - Fresh Tea,HIketron,Skin Care,"Face Mist - Fresh Tea, Face Mist - Fresh Tea (1 fl oz / 30 ml), Fresh Tea Face Mist, Hiketron Skin Care, Skin Care",True,SC-1000,39.99,,"A hydrating, antioxidant-rich toning spray with green and white tea. Complex of essential amino acids provides a youth-boosting moisture to your face.",https://cdn.shopify.com/s/files/1/2672/1228/products/FRESH_TEA_FACE_SERUM.jpg?v=1581131222,https://www.hiketron.com/products/fresh-tea-face-mist
gift-card,Hiketron Gift Card,Hiketron ,Gift Card,"Bold Man Detergent, Clear & Powerful, Cotton Fresh Laundry Detergent, Dainty Fresh for Babies, Dainty Fresh for Pets, Detergent for men, Detergent Samples, Environmentally Friendly Detergent, Enzyme Laundry Detergent, Gift Cards, Hiketron Samples, laundry detergent for men, Long Lasting Scented Detergent, Luxurious Laundry Detergents, Mambo man detergent, Pet Friendly Detergents, Royal Linen Detergent, Safe babies laundry detergent, Sensitive Skin Laundry Detergent, SUit Up Laundry Detergent",True,GC-10,10.0,Gift Card,Shopping for someone else but not sure what to give them? Give them the gift of choice with a Hiketron gift card. Gift cards are delivered by email.,https://cdn.shopify.com/s/files/1/2672/1228/products/Hktrn_LuxGftCrds_949x566_6fe86d32-9873-4c2e-9869-1c4f3da0e5f0.png?v=1578670743,https://www.hiketron.com/products/gift-card
dainty-fresh-for-pets-laundry-detergent,Hiketron Dainty Fresh For Pets: Scented Pet-friendly Laundry Detergent,HIketron,Laundry Detergent,"Dainty Fresh for Babies, Dainty Fresh for Pets, Environmentally Friendly Detergent, Enzyme Laundry Detergent, ON SALE, Pet Friendly Detergents, Safe babies laundry detergent, Sensitive Skin Laundry Detergent",True,5X-LLD-40-OZ-1P-14-FBM-DFP,49.99,Buy Dainty fresh pet safe laundry detergent,"Discover Dainty Fresh's specialized pet safe laundry detergent, featuring an impressive stain-fighting system. Keep your pets' belongings clean and fresh",https://cdn.shopify.com/s/files/1/2672/1228/products/Hiketron_Dainty_Fresh_PETS_FRONT_on_White_1500x1500_dae9548b-9e04-45c0-9c4b-1b10432809ed.jpg?v=1576531590,https://www.hiketron.com/products/dainty-fresh-for-pets-laundry-detergent
dainty-fresh-for-babies-laundry-detergent,Hiketron Dainty Fresh For Babies: Scented Baby Safe Laundry Detergent,HIketron,Laundry Detergent,"Dainty Fresh for Babies, Environmentally Friendly Detergent, Enzyme Laundry Detergent, ON SALE, Safe babies laundry detergent, Sensitive Skin Laundry Detergent",True,5X-LLD-40-OZ-1P-13-FBM-DFB,49.99,Buy Dainty fresh's best laundry detergent for babies,"Dainty Fresh best laundry detergent for babies is 5X Ultra concentrated biodegradable, liquid laundry detergent specially crafted for delicate baby skin.",https://cdn.shopify.com/s/files/1/2672/1228/products/Hiketron_Dainty_Fresh_Babies_FRONT_on_White_1500x1500_56608a18-c455-40bf-9def-9e34da6382c6.jpg?v=1576531333,https://www.hiketron.com/products/dainty-fresh-for-babies-laundry-detergent
suit-up-laundry-detergent,Hiketron Suit Up Masculine Scented Long Lasting Liquid Laundry Detergent,HIketron,Laundry Detergent,"Detergent for men, Environmentally Friendly Detergent, laundry detergent for men, Long Lasting Scented Detergent, Luxurious Laundry Detergents, Mambo man detergent, Sensitive Skin Laundry Detergent, SUit Up Laundry Detergent",True,5X-LLD-40-OZ-17-FBM-SU,49.99,Buy Suit Up laundry Detergent at Best Price,Get Suit Up masculine fragranced laundry detergent from Hiketron. Enhance your laundry routine with an enticing aroma and exceptional cleaning performance.,https://cdn.shopify.com/s/files/1/2672/1228/products/Hiketron_Suit_Up_FRONT_on_White_1500x1500_5077f562-a35a-4a54-8784-186eb91e4dd4.jpg?v=1576532483,https://www.hiketron.com/products/suit-up-laundry-detergent
mambo-man-laundry-detergent,Hiketron Mambo Man Masculine Scented Long Lasting Liquid Laundry Detergent,HIketron,Laundry Detergent,"Bold Man Detergent, Detergent for men, Environmentally Friendly Detergent, laundry detergent for men, Long Lasting Scented Detergent, Luxurious Laundry Detergents, Mambo man detergent, Sensitive Skin Laundry Detergent",True,5X-LLD-40-OZ-16-FBM-MM,49.99,Buy Mambo Man Scented Liquid Laundry Detergent,Buy high-quality mambo man detergent from hiketron. We offer the best discounts in the United States on laundry detergents. Explore Now!,https://cdn.shopify.com/s/files/1/2672/1228/products/Hiketron_Mambo_Man_FRONT_on_White_1500x1500_b23ebbd8-2820-4508-bb78-711c12505c75.jpg?v=1576532025,https://www.hiketron.com/products/mambo-man-laundry-detergent
bold-man-laundry-detergent,Hiketron Bold Man Masculine Scented Long Lasting Liquid Laundry Detergent,HIketron,Laundry Detergent,"Bold Man Detergent, Detergent for men, Environmentally Friendly Detergent, laundry detergent for men, Long Lasting Scented Detergent, masculine laundry detergent, Sensitive Skin Laundry Detergent, wood scented laundry detergent",True,5X-LLD-40-OZ-15-FBM-BM,49.99,Buy 5X Bold Laundry Detergent,"Buy Bold laundry detergent from Hiketron, tailored exclusively for men, providing long-lasting fragrance for your garments, and ensuring confidence in each wash",https://cdn.shopify.com/s/files/1/2672/1228/products/Hiketron_Bold_Man_FRONT_on_White_1500x1500_aed16a36-09f0-4599-827b-c3bfcc1d7241.jpg?v=1576530543,https://www.hiketron.com/products/bold-man-laundry-detergent
cotton-fresh-laundry-detergent,Hiketron Cotton Fresh Long Lasting Scented Liquid Laundry Detergent,HIketron,Laundry Detergent,"Cotton Fresh Laundry Detergent, Environmentally Friendly Detergent, Enzyme Laundry Detergent, Long Lasting Scented Detergent, Sensitive Skin Laundry Detergent",True,5X-LLD-40-OZ-02-FBM-CF,49.99,Buy Cotton Fresh Laundry Detergent At Best Price,"Shop cotton fresh laundry detergent available online from hiketron. Enhance your laundry journey with our premium range, of fresh and delightful fragrances.",https://cdn.shopify.com/s/files/1/2672/1228/products/Hiketron_CottonFresh_FRONT_on_White_1500x1500_49e2897d-d0d5-44fc-870a-fa74e77b7d1f.jpg?v=1576531090,https://www.hiketron.com/products/cotton-fresh-laundry-detergent
royal-linen-laundry-detergent,Hiketron Royal Linen Long Lasting Scented Liquid Laundry Detergent,HIketron,Laundry Detergent,"Environmentally Friendly Detergent, Enzyme Laundry Detergent, Long Lasting Scented Detergent, Royal Linen Detergent, Sensitive Skin Laundry Detergent",True,5X-LLD-40-OZ-01-FBM-RL,49.99,Buy Royal Linen Luxurious Laundry Detergent,"Get Royal Linen luxurious laundry detergent at Hiketron. It removes tough stains and odors, leaving an ultimate fresh scent. Grab yours now!",https://cdn.shopify.com/s/files/1/2672/1228/products/Hiketron_Royal_Linen_FRONT_on_White_1500x1500_a92e00c8-6bba-4eb2-8958-e3041f986e56.jpg?v=1707854189,https://www.hiketron.com/products/royal-linen-laundry-detergent
clear-powerful-laundry-detergent,Hiketron Clear & Powerful Scent Free Liquid Laundry Detergent,HIketron,Laundry Detergent,"Clear & Powerful, Environmentally Friendly Detergent, Enzyme Laundry Detergent, ON SALE, Sensitive Skin Laundry Detergent",True,5X-LLD-40-OZ-00-FBM-CP,49.99,Buy Clear Laundry Detergent,"Buy clear laundry detergent at Hiketron, tough on stains and odors, leaving clothes fresh and clean. Experience effective cleaning with just a click. Order now!",https://cdn.shopify.com/s/files/1/2672/1228/products/Hiketron_Clear_Powerful_FRONT_on_White_1500x1500_71fc7916-8560-4a91-ad23-620da9374d13.jpg?v=1576530799,https://www.hiketron.com/products/clear-powerful-laundry-detergent
